Sheet: Sheet1
A1: Type | B1: Date | C1: Document Number | D1: Name | E1: Debit | F1: Credit | G1: Balance | H1: Memo
A2: Deposit | B2: 2023-07-27T00:00:00.000 | C2: DP00005449 | E2: 925000 | G2: 219390892 | H2: Hoàn ứng Tien ho tro chi phi MKT 500kCH T07.2023 cho cua hang
A3: Journal | B3: 2023-07-27T00:00:00.000 | C3: JV00335296 | F3: 783200 | G3: 218607692 | H3: 1104_Vua Nệm hoàn tiền DH SOTNG02-KC 2464

Sheet: GeneralLedger
A1: Vua Nem Joint Stock Company
A2: HNI-Công ty Cổ phần Vua Nệm (Consolidated)
A3: General Ledger
A4: Jul 2023
A7: Account | B7: Type | C7: Date | D7: Document Number | E7: Name | F7: Debit | G7: Credit | H7: Balance
A8: 111 - Tiền mặt | H8: 0
A9: 1111 - Tiền VNĐ | H9: 0
A10: 111111 - HNICTY/Tiền mặt VNĐ-Hà Nội-Công ty | H10: 214620512
B11: Journal | C11: 2023-07-03T00:00:00.000 | D11: JV00332204 | F11: 8500000 | H11: =R[-1]C+RC[-2]-RC[-1] -> 223120512
B12: Journal | C12: 2023-07-03T00:00:00.000 | D12: JV00332205 | F12: 5500000 | H12: =R[-1]C+RC[-2]-RC[-1] -> 228620512
B13: Journal | C13: 2023-07-03T00:00:00.000 | D13: JV00332206 | F13: 1600000 | H13: =R[-1]C+RC[-2]-RC[-1] -> 230220512
B14: Journal | C14: 2023-07-03T00:00:00.000 | D14: JV00332208 | F14: 800000 | H14: =R[-1]C+RC[-2]-RC[-1] -> 231020512
B15: Check | C15: 2023-07-03T00:00:00.000 | D15: 3046 | E15: VN1794 Trần Thị Thanh Tú | G15: 2900000 | H15: =R[-1]C+RC[-2]-RC[-1] -> 228120512
B16: Journal | C16: 2023-07-03T00:00:00.000 | D16: JV00332207 | F16: 800000 | H16: =R[-1]C+RC[-2]-RC[-1] -> 228920512
B17: Journal | C17: 2023-07-03T00:00:00.000 | D17: JV00332209 | F17: 1750000 | H17: =R[-1]C+RC[-2]-RC[-1] -> 230670512
B18: Journal | C18: 2023-07-03T00:00:00.000 | D18: JV00332210 | F18: 1750000 | H18: =R[-1]C+RC[-2]-RC[-1] -> 232420512
B19: Journal | C19: 2023-07-04T00:00:00.000 | D19: JV00332462 | F19: 700000 | H19: =R[-1]C+RC[-2]-RC[-1] -> 233120512
B20: Deposit | C20: 2023-07-04T00:00:00.000 | D20: DP00005365 | F20: 4325882 | H20: =R[-1]C+RC[-2]-RC[-1] -> 237446394
B21: Check | C21: 2023-07-04T00:00:00.000 | D21: 3047 | E21: ADV-VNHDBank Thẻ tín dụng HDBank | G21: 5000000 | H21: =R[-1]C+RC[-2]-RC[-1] -> 232446394
B22: Check | C22: 2023-07-04T00:00:00.000 | D22: 3050 | E22: ADV-VNHDBank Thẻ tín dụng HDBank | G22: 5000000 | H22: =R[-1]C+RC[-2]-RC[-1] -> 227446394
B23: Check | C23: 2023-07-04T00:00:00.000 | D23: 3048 | E23: ADV-VNHDBank Thẻ tín dụng HDBank | G23: 5000000 | H23: =R[-1]C+RC[-2]-RC[-1] -> 222446394
B24: Check | C24: 2023-07-04T00:00:00.000 | D24: 3049 | E24: ADV-VNHDBank Thẻ tín dụng HDBank | G24: 10000000 | H24: =R[-1]C+RC[-2]-RC[-1] -> 212446394
B25: Check | C25: 2023-07-06T00:00:00.000 | D25: 3051 | E25: VN3787 Lee Wade Snively Hinshaw | G25: 71100000 | H25: =R[-1]C+RC[-2]-RC[-1] -> 141346394
B26: Check | C26: 2023-07-06T00:00:00.000 | D26: 3052 | E26: V-00000322 Công ty cổ phần Vua Nệm | G26: 30000000 | H26: =R[-1]C+RC[-2]-RC[-1] -> 111346394
B27: Deposit | C27: 2023-07-06T00:00:00.000 | D27: DP00005371 | F27: 97000 | H27: =R[-1]C+RC[-2]-RC[-1] -> 111443394
B28: Deposit | C28: 2023-07-07T00:00:00.000 | D28: DP00005373 | F28: 4038469 | H28: =R[-1]C+RC[-2]-RC[-1] -> 115481863
B29: Deposit | C29: 2023-07-07T00:00:00.000 | D29: DP00005372 | F29: 50000 | H29: =R[-1]C+RC[-2]-RC[-1] -> 115531863
B30: Deposit | C30: 2023-07-10T00:00:00.000 | D30: DP00005377 | F30: 496210 | H30: =R[-1]C+RC[-2]-RC[-1] -> 116028073
B31: Deposit | C31: 2023-07-10T00:00:00.000 | D31: DP00005379 | F31: 2702284 | H31: =R[-1]C+RC[-2]-RC[-1] -> 118730357
B32: Deposit | C32: 2023-07-10T00:00:00.000 | D32: DP00005378 | F32: 7675944 | H32: =R[-1]C+RC[-2]-RC[-1] -> 126406301
B33: Journal | C33: 2023-07-10T00:00:00.000 | D33: JV00333207 | G33: 1000000 | H33: =R[-1]C+RC[-2]-RC[-1] -> 125406301
B34: Deposit | C34: 2023-07-11T00:00:00.000 | D34: DP00005387 | F34: 450000 | H34: =R[-1]C+RC[-2]-RC[-1] -> 125856301
B35: Journal | C35: 2023-07-11T00:00:00.000 | D35: JV00333197 | G35: 3000000 | H35: =R[-1]C+RC[-2]-RC[-1] -> 122856301
B36: Customer Refund | C36: 2023-07-12T00:00:00.000 | D36: 27578 | E36: C-00677164 Chị Thoại | G36: 4360000 | H36: =R[-1]C+RC[-2]-RC[-1] -> 118496301
B37: Deposit | C37: 2023-07-13T00:00:00.000 | D37: DP00005398 | F37: 7500000 | H37: =R[-1]C+RC[-2]-RC[-1] -> 125996301
B38: Deposit | C38: 2023-07-13T00:00:00.000 | D38: DP00005397 | F38: 113579098 | H38: =R[-1]C+RC[-2]-RC[-1] -> 239575399
B39: Check | C39: 2023-07-13T00:00:00.000 | D39: 3054 | E39: VN0449 Cún Thế Vinh | G39: 8280000 | H39: =R[-1]C+RC[-2]-RC[-1] -> 231295399
B40: Bill Payment | C40: 2023-07-13T00:00:00.000 | D40: 3053 | E40: VN2923 Trịnh Văn Kiên | G40: 1400000 | H40: =R[-1]C+RC[-2]-RC[-1] -> 229895399
B41: Deposit | C41: 2023-07-13T00:00:00.000 | D41: DP00005395 | F41: 900000 | H41: =R[-1]C+RC[-2]-RC[-1] -> 230795399
B42: Bill Payment | C42: 2023-07-13T00:00:00.000 | D42: VPHNI-LOC00012328 | E42: VN1167 Trần Ngọc Đoan Trinh | G42: 17785460 | H42: =R[-1]C+RC[-2]-RC[-1] -> 213009939
B43: Deposit | C43: 2023-07-13T00:00:00.000 | D43: DP00005399 | F43: 7320000 | H43: =R[-1]C+RC[-2]-RC[-1] -> 220329939
B44: Check | C44: 2023-07-14T00:00:00.000 | D44: 3055 | E44: V-00000322 Công ty cổ phần Vua Nệm | G44: 50000000 | H44: =R[-1]C+RC[-2]-RC[-1] -> 170329939
B45: Journal | C45: 2023-07-17T00:00:00.000 | D45: JV00334178 | F45: 400000 | H45: =R[-1]C+RC[-2]-RC[-1] -> 170729939
B46: Check | C46: 2023-07-18T00:00:00.000 | D46: 3056 | E46: ADV-VNHCNS Công ty-HCNS | G46: 100000 | H46: =R[-1]C+RC[-2]-RC[-1] -> 170629939
B47: Check | C47: 2023-07-18T00:00:00.000 | D47: 3057 | E47: V-00000322 Công ty cổ phần Vua Nệm | G47: 30000000 | H47: =R[-1]C+RC[-2]-RC[-1] -> 140629939
B48: Deposit | C48: 2023-07-19T00:00:00.000 | D48: DP00005418 | F48: 2166245 | H48: =R[-1]C+RC[-2]-RC[-1] -> 142796184
B49: Deposit | C49: 2023-07-20T00:00:00.000 | D49: DP00005423 | F49: 12555000 | H49: =R[-1]C+RC[-2]-RC[-1] -> 155351184
B50: Bill Payment | C50: 2023-07-20T00:00:00.000 | D50: 3058 | E50: VN1167 Trần Ngọc Đoan Trinh | G50: 4779091 | H50: =R[-1]C+RC[-2]-RC[-1] -> 150572093
B51: Deposit | C51: 2023-07-20T00:00:00.000 | D51: DP00005424 | F51: 21644000 | H51: =R[-1]C+RC[-2]-RC[-1] -> 172216093
B52: Deposit | C52: 2023-07-20T00:00:00.000 | D52: DP00005425 | F52: 82147411 | H52: =R[-1]C+RC[-2]-RC[-1] -> 254363504
B53: Deposit | C53: 2023-07-20T00:00:00.000 | D53: DP00005426 | F53: 18999996 | H53: =R[-1]C+RC[-2]-RC[-1] -> 273363500
B54: Journal | C54: 2023-07-20T00:00:00.000 | D54: JV00334549 | F54: 227000 | H54: =R[-1]C+RC[-2]-RC[-1] -> 273590500
B55: Journal | C55: 2023-07-20T00:00:00.000 | D55: JV00334553 | G55: 3796551 | H55: =R[-1]C+RC[-2]-RC[-1] -> 269793949
B56: Bill Payment | C56: 2023-07-20T00:00:00.000 | D56: VPHNI-LOC00012441 | E56: VN1167 Trần Ngọc Đoan Trinh | G56: 8800000 | H56: =R[-1]C+RC[-2]-RC[-1] -> 260993949
B57: Bill Payment | C57: 2023-07-20T00:00:00.000 | D57: VPHNI-LOC00012440 | E57: VN1167 Trần Ngọc Đoan Trinh | G57: 5469750 | H57: =R[-1]C+RC[-2]-RC[-1] -> 255524199
B58: Customer Refund | C58: 2023-07-21T00:00:00.000 | D58: 27719 | E58: C-00674898 Anh Chị Oanh Choé | G58: 2474000 | H58: =R[-1]C+RC[-2]-RC[-1] -> 253050199
B59: Deposit | C59: 2023-07-21T00:00:00.000 | D59: DP00005429 | F59: 1503600 | H59: =R[-1]C+RC[-2]-RC[-1] -> 254553799
B60: Deposit | C60: 2023-07-24T00:00:00.000 | D60: DP00005433 | F60: 6059993 | H60: =R[-1]C+RC[-2]-RC[-1] -> 260613792
B61: Check | C61: 2023-07-24T00:00:00.000 | D61: 3059 | E61: V-00000322 Công ty cổ phần Vua Nệm | G61: 50000000 | H61: =R[-1]C+RC[-2]-RC[-1] -> 210613792
B62: Deposit | C62: 2023-07-26T00:00:00.000 | D62: DP00005446 | F62: 7852100 | H62: =R[-1]C+RC[-2]-RC[-1] -> 218465892
B63: Deposit | C63: 2023-07-27T00:00:00.000 | D63: DP00005449 | F63: 925000 | H63: =R[-1]C+RC[-2]-RC[-1] -> 219390892
B64: Journal | C64: 2023-07-27T00:00:00.000 | D64: JV00335296 | G64: 783200 | H64: =R[-1]C+RC[-2]-RC[-1] -> 218607692
A65: Total - 111111 - HNICTY/Tiền mặt VNĐ-Hà Nội-Công ty | F65: =SUM(R[-55]C:R[-1]C) -> 325015232 | G65: =SUM(R[-55]C:R[-1]C) -> 321028052 | H65: =R[-1]C -> 218607692
A66: Total - 1111 - Tiền VNĐ | F66: =SUM(R[-57]C,R[-1]C) -> 325015232 | G66: =SUM(R[-57]C,R[-1]C) -> 321028052 | H66: =R[-57]C+R[-1]C -> 218607692
A67: Total - 111 - Tiền mặt | F67: =SUM(R[-59]C,R[-1]C) -> 325015232 | G67: =SUM(R[-59]C,R[-1]C) -> 321028052 | H67: =R[-59]C+R[-1]C -> 218607692